h1,p
Código Penal AguascalientesArtículo 1. Principio de legalidad,"A nadie se le aplicará pena o medida de seguridad alguna si éstas no se encuentran previamente establecidas por una figura típica exactamente aplicable al hecho punible que corresponda, quedando prohibido imponerlas por simple analogía y aún por mayoría de razón."
"Código Penal AguascalientesArtículo 2. Principios de intervención mínima, lesividad y exterioridad","Para que una acción u omisión sean consideradas delictivas, se requiere que afecten o pongan en peligro concreto, sin causa justificada, al bien jurídico tutelado por la ley penal."
"Código Penal AguascalientesArtículo 2. Principios de intervención mínima, lesividad y exterioridad",El bien jurídico es el interés individual o colectivo protegido por un tipo penal en particular.
"Código Penal AguascalientesArtículo 2. Principios de intervención mínima, lesividad y exterioridad","El resultado podrá ser de afectación, destrucción, disminución o compresión del bien jurídico tutelado o su puesta en peligro concreto, como probabilidad de afectación, destrucción, disminución o compresión del bien jurídico."
Código Penal AguascalientesArtículo 3. Principio de culpabilidad,"No podrá aplicarse pena alguna, si la acción o la omisión no han sido realizadas culpablemente. La medida de la pena estará en relación directa con el grado de culpabilidad del sujeto respecto del hecho punible cometido, así como de la gravedad de éste."
Código Penal AguascalientesArtículo 3. Principio de culpabilidad,"Igualmente se requerirá la acreditación de la culpabilidad del sujeto para la aplicación de una medida de seguridad, si ésta se impone accesoriamente a la pena, y su duración estará en relación directa con el grado de aquélla."
Código Penal AguascalientesArtículo 3. Principio de culpabilidad,La sanción que se aplique por la comisión de un delito no trascenderá de la persona y bienes de los que intervengan en aquél.
Código Penal AguascalientesArtículo 4. Principio de jurisdiccionalidad,Las consecuencias jurídicas del delito solo podrán imponerse por resolución de autoridad judicial.
Código Penal AguascalientesArtículo 4. Principio de jurisdiccionalidad,"Las disposiciones establecidas en este Código se aplicarán respetando los derechos humanos, fundamentales y garantías de las personas establecidas en la Constitución Política de los Estados Unidos Mexicanos, el Derecho Internacional de los Derechos humanos del que el Estado Mexicano sea parte, la Constitución Política del Estado de Aguascalientes, y toda normatividad que derive de ellos."
Código Penal AguascalientesArtículo 5. Principios de dignidad e igualdad,"Las disposiciones establecidas en este Código se aplicarán respetando la dignidad humana de las personas, sin establecerse diferencia negativa alguna por razón de raza, origen étnico, idioma, nacionalidad, género, edad, discapacidades, condición social, posición económica, condiciones de salud, credo o religión, opiniones, preferencias, estado civil, cualesquiera otra circunstancia de análoga naturaleza u otros universalmente reconocidos como inaceptables con arreglo al derecho internacional"
Código Penal AguascalientesArtículo 6. Principio Pro Homine,"Toda persona será tratada como ser humano sujeto de derechos y no como objeto, respetando su dignidad, seguridad e integridad física, psíquica y moral."
Código Penal AguascalientesArtículo 6. Principio Pro Homine,"En caso de que disposiciones normativas aplicables sean contradictorias, o que de su interpretación o de una norma deriven diversos significados, deberá escogerse aquel que beneficie más a la protección y garantía de los derechos fundamentales. En el supuesto de que se encuentren enfrentados derechos de diversas personas, deberá observarse, además, las reglas de adecuación, necesidad y proporcionalidad para equilibrar los derechos en la medida de lo posible."
Código Penal AguascalientesArtículo 7. Validez personal,"El contenido de las figuras típicas descritas en este Código obliga a todos los habitantes del Estado de Aguascalientes, sin excepción alguna, sean nacionales o extranjeros, residentes o transeúntes."
Código Penal AguascalientesArtículo 8. Validez espacial,"Las consecuencias jurídicas establecidas se aplicarán a los responsables, por los hechos punibles que se inicien, preparen o cometan en el Estado, y respecto de aquellos que se inicien o preparen fuera del Estado, cuando el resultado se produzca en la entidad"
Código Penal AguascalientesArtículo 9. Validez temporal,"Para efectos de aplicación de la norma, se tendrá por ejecutado el hecho punible descrito en cada figura típica, en el lugar y tiempo en que se concretice el resultado de lesión o de peligro del bien jurídico tutelado. Es aplicable la ley vigente al momento de realización del hecho punible."
Código Penal AguascalientesArtículo 9. Validez temporal,"Cuando entre la comisión de un hecho punible y la extinción de la pena o medida de seguridad aplicadas, entrare en vigor un nuevo precepto legal en materia penal o se modificare uno vigente, se aplicará aquella norma que mantenga un equilibrio adecuado entre los derechos constitucionales de la víctima y del inculpado, sin que se afecten notablemente aquellos, situación que siempre será resuelta por la autoridad judicial que conozca del caso."
Código Penal AguascalientesArtículo 10. Regla de solución,"Cuando una misma materia aparezca regulada por diversas disposiciones, se aplicará aquella que más beneficie a los derechos fundamentales. En el supuesto de que se encuentren enfrentados derechos de diversas personas, deberán observarse, además, las reglas de adecuación, necesidad y proporcionalidad para equilibrar los derechos en la medida de lo posible."
Código Penal AguascalientesArtículo 10. Regla de solución,"Cuando se realicen conductas típicas contempladas en Leyes Generales expedidas por el Congreso de la Unión, y que por su disposición competa conocer y resolver a las autoridades del Estado, serán éstas las que se apliquen, observando las disposiciones generales de este Código en lo no previsto por tales leyes"
Código Penal AguascalientesArtículo 11. Elementos del delito,"Para que puedan aplicarse legalmente las penas y medidas de seguridad previstas en cada una de las figuras típicas reguladas en este Código debe acreditarse en cada hecho punible, la existencia de los siguientes elementos, para la configuración del delito:"
Código Penal AguascalientesArtículo 11. Elementos del delito,I. La Conducta;
Código Penal AguascalientesArtículo 11. Elementos del delito,II. La Tipicidad;
Código Penal AguascalientesArtículo 11. Elementos del delito,III. La Antijuridicidad; y
Código Penal AguascalientesArtículo 11. Elementos del delito,IV. La Culpabilidad.
Código Penal AguascalientesArtículo 11. Elementos del delito,"Tratándose de sujetos declarados inimputables, para que se les pueda aplicar la correspondiente medida de seguridad, bastará la acreditación de los elementos descritos en las Fracciones I a la III."
"Código Penal AguascalientesArtículo 12. Delito instantáneo, permanente y continuado","El delito es Instantáneo cuando su consumación se agota en el mismo momento en que se han realizado todos sus elementos constitutivos; es Permanente o Continuo cuando la consumación se prolonga en el tiempo; y Continuado cuando con unidad de propósito y pluralidad de conductas, se configura una misma figura típica en perjuicio de la misma víctima."
Código Penal AguascalientesArtículo 13. La conducta y nexo,Sólo serán considerados inculpados del hecho punible las personas físicas.
Código Penal AguascalientesArtículo 13. La conducta y nexo,La conducta penalmente relevante puede ser de acción u omisión en las que medie voluntad.
Código Penal AguascalientesArtículo 13. La conducta y nexo,"El resultado de afectación o de puesta en peligro concreto será imputado objetivamente a una persona cuando fuere consecuencia de su acción y medios adecuados para producirlo, salvo que hubiesen sobrevenido en virtud de un acontecimiento ajeno a la propia acción."
Código Penal AguascalientesArtículo 13. La conducta y nexo,"El resultado de afectación o de puesta en peligro concreto, se entenderá imputado objetivamente por omisión, cuando la no evitación de aquel, al infringir un especial deber jurídico de la persona equivalga, según el sentido del texto de la Ley, a una causación. A tal efecto, se equiparará la acción a la omisión:"
Código Penal AguascalientesArtículo 13. La conducta y nexo,I. Cuando exista una específica obligación legal o contractual de actuar;
Código Penal AguascalientesArtículo 13. La conducta y nexo,"II. La persona se encuentre en una efectiva y concreta posición de custodia de la vida, la salud o integridad corporal de algún miembro de su familia; o"
Código Penal AguascalientesArtículo 13. La conducta y nexo,"III. Cuando el omitente haya creado una ocasión de riesgo para el bien jurídicamente protegido por el particular tipo penal, mediante una acción u omisión precedente."
Código Penal AguascalientesArtículo 13. La conducta y nexo,La conducta de acción u omisión puede ser de contenido doloso o de contenido culposo.
Código Penal AguascalientesArtículo 13. La conducta y nexo,Las conductas dolosas o culposas solamente serán punibles en los casos expresamente determinados por la ley
Código Penal AguascalientesArtículo 14. Dolo,"Actúa dolosamente el que conociendo los elementos de la descripción típica o previendo como posible el resultado típico, quiere o acepta la realización del hecho punible descrito."
Código Penal AguascalientesArtículo 14. Dolo,"También actúa dolosamente el que queriendo producir el resultado de afectación o puesta en peligro concreto, produce otro, por error en la persona o en el objeto, y se aplicará en este caso, la pena o medida de seguridad correspondiente al tipo comprobado, valorándose las circunstancias de configuración del hecho."
Código Penal AguascalientesArtículo 15. Culpa,"Actúa culposamente el que realiza el hecho punible por incumplir un deber de cuidado que debía y podía haber observado, según sus condiciones personales y las circunstancias de realización del hecho."
Código Penal AguascalientesArtículo 16. Determinación de la conducta culposa,Para que una conducta sea culposa debe determinarse:
Código Penal AguascalientesArtículo 16. Determinación de la conducta culposa,"I. El deber de cuidado motivo de observación, y la base legal de su existencia y obligatoriedad;"
Código Penal AguascalientesArtículo 16. Determinación de la conducta culposa,II. Si el deber de cuidado pudo ser observado por la persona según sus circunstancias personales y las condiciones del hecho;
Código Penal AguascalientesArtículo 16. Determinación de la conducta culposa,"III. El lugar, tiempo y circunstancias en que se incumplió el deber de cuidado; y"
Código Penal AguascalientesArtículo 16. Determinación de la conducta culposa,IV. Que el incumplimiento a tal deber de cuidado sea lo que provocó el resultado típico que se atribuye a la persona
Código Penal AguascalientesArtículo 17. Formas de intervención,Serán considerados interventores del hecho punible:
Código Penal AguascalientesArtículo 17. Formas de intervención,"I. Los autores, teniendo esa calidad:"
Código Penal AguascalientesArtículo 17. Formas de intervención,a) Los que realicen la actividad típica por sí solos;
Código Penal AguascalientesArtículo 17. Formas de intervención,b) Los que realicen la actividad típica conjuntamente; o
Código Penal AguascalientesArtículo 17. Formas de intervención,"c) Los que realicen la actividad típica por medio de otro, del que se sirvan como instrumento."
Código Penal AguascalientesArtículo 17. Formas de intervención,"II. Los partícipes, teniendo esa calidad:"
Código Penal AguascalientesArtículo 17. Formas de intervención,a) Los que inducen dolosa y directamente al autor o coautores a ejecutar la actividad típica-
Código Penal AguascalientesArtículo 17. Formas de intervención,b) Los que cooperan dolosamente en su ejecución con una conducta sin la cual no se habría efectuado;
Código Penal AguascalientesArtículo 17. Formas de intervención,"c) Los que cooperan dolosamente en la ejecución de la actividad típica con conductas anteriores o posteriores a la misma, previo acuerdo con el autor o coautores; y"
Código Penal AguascalientesArtículo 17. Formas de intervención,"d) Los que intervinieren dolosamente con otros en la comisión del hecho, aunque no conste cuál de ellos produjo directamente el resultado."
Código Penal AguascalientesArtículo 17. Formas de intervención,"Los autores y partícipes a que se refiere el presente Artículo, responderán cada uno en la medida de su propia culpabilidad."
Código Penal AguascalientesArtículo 17. Formas de intervención,"En los casos de complicidad correspectiva a que se refiere el inciso d) de la Fracción II del presente Artículo, se aplicará a los responsables hasta la mitad de la punibilidad señalada en la descripción típica que corresponda"
Código Penal AguascalientesArtículo 18. Hecho punible emergente,"Si varias personas toman parte en la realización de un hecho punible determinado y alguna de ellas realiza uno distinto, sin existir acuerdo con las otras, todas serán consideradas como inculpados en la comisión del nuevo hecho punible, salvo que concurran los requisitos siguientes:"
Código Penal AguascalientesArtículo 18. Hecho punible emergente,I. Que el nuevo hecho punible no sirva de medio adecuado para cometer el principal o inicial;
Código Penal AguascalientesArtículo 18. Hecho punible emergente,"II. Que el nuevo hecho punible no sea una consecuencia necesaria o natural del principal o inicial, o de los medios utilizados; o"
Código Penal AguascalientesArtículo 18. Hecho punible emergente,III. Que no se haya sabido antes que se iba a cometer el nuevo hecho punible.
Código Penal AguascalientesArtículo 19. Comunicabilidad de las circunstancias,"El aumento, disminución o exclusión de las penas o medidas de seguridad, fundados en las calidades, en las relaciones personales o en las circunstancias subjetivas del autor de un hecho delictivo, no son aplicables a los demás autores, partícipes o cómplices."
Código Penal AguascalientesArtículo 19. Comunicabilidad de las circunstancias,"Son aplicables los que se fundan en circunstancias objetivas, si los demás autores, partícipes o cómplices tienen conocimiento de ellas en el momento de la realización del hecho."
Código Penal AguascalientesArtículo 20. Ausencia de conducta,"No existe conducta cuando se provoca un resultado de afectación o de puesta en peligro concreto por fuerza física irresistible, impedimento físico, movimientos reflejos o cualquier otro caso en que haya ausencia de voluntad del inculpado."
Código Penal AguascalientesArtículo 20. Ausencia de conducta,-
Código Penal AguascalientesArtículo 21. Responsabilidad de personas colectivas,"Cuando algún integrante o representante de una persona jurídica colectiva, con excepción de las instituciones del Estado, facilite los medios para la comisión de un hecho punible, de modo que éste resulte cometido a su nombre, bajo su amparo o en beneficio de ella, los tribunales, con la audiencia del representante legal de aquélla, aplicarán las medidas jurídicas previstas para el efecto por este Código, sin perjuicio de la responsabilidad individual por el o los hechos delictivos cometidos."
Código Penal AguascalientesArtículo 22. La tipicidad,La tipicidad se integra cuando la conducta desplegada por el sujeto activo se adecua a los elementos contenidos en la descripción típica establecida en la norma penal.
Código Penal AguascalientesArtículo 23. Elementos de la descripción típica,Se considerará adecuada la conducta a la descripción típica cuando se reúnan los siguientes elementos:
Código Penal AguascalientesArtículo 23. Elementos de la descripción típica,I. Bien jurídico tutelado por la figura típica;
Código Penal AguascalientesArtículo 23. Elementos de la descripción típica,"II. El resultado de afectación o de puesta en peligro concreto del bien jurídico tutelado, y su imputación objetiva a la acción u omisión;"
Código Penal AguascalientesArtículo 23. Elementos de la descripción típica,"III. La acción o movimiento corporal establecida en la figura típica, adecuada para producir el resultado; o la omisión o no realización de una actividad ordenada en la figura típica, adecuada para evitar el resultado;"
Código Penal AguascalientesArtículo 23. Elementos de la descripción típica,"IV. La víctima o sujeto pasivo, titular del bien jurídico tutelado, tomando en cuenta las calidades que requiera la figura típica;"
Código Penal AguascalientesArtículo 23. Elementos de la descripción típica,"V. El inculpado o sujeto activo, por haber ejecutado la acción u omisión como autor o partícipe, tomando en cuenta las calidades que requiera la figura típica;"
Código Penal AguascalientesArtículo 23. Elementos de la descripción típica,"VI. El objeto material, persona o entidad sobre el que recae la conducta establecida en la figura típica;"
Código Penal AguascalientesArtículo 23. Elementos de la descripción típica,"VII. Las referencias de medios, tiempo, lugar, modo y ocasión que pueda requerir la descripción"
Código Penal AguascalientesArtículo 23. Elementos de la descripción típica,típica;
Código Penal AguascalientesArtículo 23. Elementos de la descripción típica,"VIII. Los elementos normativos que puedan exigirse en la particular descripción típica, que requieran un especial juicio de valoración jurídica o cultural; y"
Código Penal AguascalientesArtículo 23. Elementos de la descripción típica,IX. El dolo o la culpa según lo requiera el particular tipo penal.
Código Penal AguascalientesArtículo 24. Atipicidad,No existe tipicidad cuando falte alguno de los elementos que integren la figura típica que corresponda.
Código Penal AguascalientesArtículo 25. Error de tipo,Tampoco existirá tipicidad cuando se ejecute la acción u omisión bajo un error invencible respecto de alguno de los elementos esenciales que integren la figura típica que corresponda
Código Penal AguascalientesArtículo 26. La antijuridicidad,"Un hecho punible se considera antijurídico cuando el inculpado incumple un mandato o viola una prohibición y afecta o pone en peligro concreto un interés jurídicamente tutelado por la figura típica que corresponda, sin estar justificado para actuar de esa manera."
Código Penal AguascalientesArtículo 27. Causas de Justificación,"La realización de una conducta típica y antijurídica, se justifica:"
Código Penal AguascalientesArtículo 27. Causas de Justificación,"I. Cuando exista consentimiento válido del titular del bien jurídico, o del legitimado jurídicamente para otorgarlo, y siempre que el bien jurídico afectado sea de aquellos de que puedan disponer libremente los particulares;"
Código Penal AguascalientesArtículo 27. Causas de Justificación,"II. Cuando se actúa en defensa de bienes jurídicos propios o ajenos, repeliendo una agresión imprevista, actual o inminente, sin derecho, y siempre que exista la necesidad razonable del medio empleado para impedirla o rechazarla, y que no medie provocación suficiente e inmediata por parte del agredido o de la persona a quien se defienda;"
Código Penal AguascalientesArtículo 27. Causas de Justificación,"III. Cuando en situación de peligro grave, actual o inminente, para un bien jurídico, propio o ajeno, se afecte otro bien jurídico de igual o menor jerarquía, para evitar un resultado mayor, siempre que el titular del bien salvado no haya provocado dolosamente el propio peligro y que no se tenga al alcance otro medio utilizable y menos perjudicial;"
Código Penal AguascalientesArtículo 27. Causas de Justificación,"IV. Cuando se afecte a una persona en cumplimiento de un deber jurídico, siempre y cuando no exista el sólo propósito de causarle daño; o"
Código Penal AguascalientesArtículo 27. Causas de Justificación,"V. Cuando se actúa por obediencia legítima y jerárquica, aún cuando la orden constituya comisión de un hecho delictivo, si esta circunstancia no es notoria, ni se prueba que el sujeto activo la conocía, ni era previsible racionalmente."
Código Penal AguascalientesArtículo 27. Causas de Justificación,"Se justificará igualmente la conducta típica y antijurídica, cuando se cause, a la persona o las personas, un daño suficiente para evitar la introducción o los actos idóneos tendientes a introducirse, sin derecho, a su negocio, su hogar o sus dependencias, a los de su familia, a los de cualquier persona que tenga el deber de defender, o al sitio donde se encuentren bienes jurídicos propios o ajenos sobre los que tenga la misma obligación."
Código Penal AguascalientesArtículo 27. Causas de Justificación,"También se justificará la conducta típica y antijurídica, cuando se cause un daño suficiente para evitar cualquier agresión real, actual e inminente, que se cometa en el interior o en las dependencias de una negociación o de una casa habitación."
Código Penal AguascalientesArtículo 27. Causas de Justificación,"Para determinar la relación de suficiencia en los supuestos descritos en los dos párrafos anteriores, se tomará en cuenta la furtividad y la violencia que, sobre las personas o sobre las cosas, haya ejercido el agresor para introducirse al inmueble o que ejerza para mantenerse dentro de él."
Código Penal AguascalientesArtículo 27. Causas de Justificación,"En los casos de exceso de legítima defensa se impondrá una cuarta parte de la sanción prevista para el delito de que se trate, quedando subsistente la imputación a título doloso."
Código Penal AguascalientesArtículo 28. La culpabilidad,"Para que la conducta típica y antijurídica pueda ser considerada delictiva, debe además realizarse culpablemente."
Código Penal AguascalientesArtículo 28. La culpabilidad,"La culpabilidad consiste en el juicio de reproche que formula la autoridad judicial al inculpado, por ser éste imputable, haya realizado la conducta típica y antijurídica conociendo la ilicitud de su actuar, y se encontraba en condiciones de actuar sin contrariar la norma penal."
Código Penal AguascalientesArtículo 29. Imputabilidad,"Es imputable la persona que tiene capacidad para comprender la naturaleza e ilicitud de la conducta que realizó, y conducirse con base a esa comprensión"
Código Penal AguascalientesArtículo 30. Inimputabilidad y acción libre en su causa,"Si el inculpado, al realizar la conducta típica productora del resultado de afectación o de puesta en peligro concreto, padece trastorno mental o se encuentra en una etapa de desarrollo intelectual retardado, que le impida comprender el carácter ilícito del hecho o conducirse de acuerdo a esa comprensión, atendiendo a las peculiaridades de su personalidad y a las circunstancias específicas de su comportamiento, los tribunales, tomando en cuenta opinión médica especializada sobre las características personales de tal inculpado, ordenará la aplicación de una medida de seguridad."
Código Penal AguascalientesArtículo 30. Inimputabilidad y acción libre en su causa,Lo dispuesto en el párrafo anterior no se aplica en los casos en que el inculpado hubiere provocado dolosamente su estado de trastorno mental en cuyo caso se considerará imputable y responderá por el resultado típico producido en tal situación
"Código Penal AguascalientesArtículo 31. Inculpabilidad, error de prohibición y no exigibilidad de otra conducta",No se formulará juicio de reproche al inculpado que:
"Código Penal AguascalientesArtículo 31. Inculpabilidad, error de prohibición y no exigibilidad de otra conducta","I. Realice la conducta típica y antijurídica, bajo miedo o temor de un mal actual y grave, sea o no provocado por el actuar de un tercero;"
"Código Penal AguascalientesArtículo 31. Inculpabilidad, error de prohibición y no exigibilidad de otra conducta","II. Realice la conducta típica y antijurídica, bajo un error invencible sobre la ilicitud de la conducta, ya sea porque desconozca la existencia de la norma o su alcance, o porque crea que está justificada su conducta; o"
"Código Penal AguascalientesArtículo 31. Inculpabilidad, error de prohibición y no exigibilidad de otra conducta","III. Cuando razonablemente no pueda exigírsele una conducta diversa, en virtud de no haberse podido conducir conforme a derecho."
Código Penal AguascalientesArtículo 32. Punibilidad en caso de errores vencibles,"Los errores previstos en los Artículos 25 y 31 de este Código se considerarán vencibles si las condiciones personales del inculpado y las circunstancias en que se encontraba le permitían advertir con facilidad su falsa apreciación de la realidad, para salir de su error."
Código Penal AguascalientesArtículo 32. Punibilidad en caso de errores vencibles,Cuando los errores a que se refiere el presente capítulo sean vencibles:
Código Penal AguascalientesArtículo 32. Punibilidad en caso de errores vencibles,"I. La sanción será la establecida en la figura típica culposa, si el hecho de que se trata admite tal configuración; o"
Código Penal AguascalientesArtículo 32. Punibilidad en caso de errores vencibles,"II. En caso de que el hecho no admita configuración culposa, se aplicará al responsable hasta la mitad de la punibilidad prevista en la figura típica de que se trate."
