h1,p
Código Penal AguascalientesArtículo 165. Falsedad ante la autoridad o fedatario público,"No podrá ser responsable de Falsedad ante la Autoridad quien tenga el carácter de indiciado, procesado, inculpado o imputado en un procedimiento penal."
Código Penal AguascalientesArtículo 166. Desobediencia de particulares,La Desobediencia de Particulares consiste en:
Código Penal AguascalientesArtículo 166. Desobediencia de particulares,"I. Rehusar, sin justa causa, prestar un servicio de interés público a que la ley lo obligue;"
Código Penal AguascalientesArtículo 166. Desobediencia de particulares,II. Desobedecer un mandato legítimo de la autoridad;
Código Penal AguascalientesArtículo 166. Desobediencia de particulares,"III. No comparecer ante autoridad cuando legalmente se lo exija, para declarar o rendir los informes que le pidan, previo agotamiento de los medios de apremio existentes para cada caso; o"
Código Penal AguascalientesArtículo 166. Desobediencia de particulares,"IV. Generar y utilizar información falsa o alterada, respecto de los rendimientos o beneficios que obtenga, y cuando estando legalmente obligado a entregar a una autoridad información sobre los rendimientos o beneficios que obtenga, la oculte, siempre que tenga el carácter de contratista, permisionario, asignatario, titular de una concesión de prestación de un servicio público de explotación, aprovechamiento o uso de bienes del dominio del Estado, con la finalidad de obtener un beneficio para sí o para un tercero."
Código Penal AguascalientesArtículo 166. Desobediencia de particulares,Al responsable de Desobediencia de Particulares se le aplicarán de 3 meses a 9 años de prisión y de 30 a 100 días multa
Código Penal AguascalientesArtículo 167. Resistencia de particulares,La Resistencia de Particulares consiste en:
Código Penal AguascalientesArtículo 167. Resistencia de particulares,I. La oposición a que la autoridad o sus agentes ejerzan alguna de sus funciones empleando la violencia física o moral;
Código Penal AguascalientesArtículo 167. Resistencia de particulares,"II. Evitar por todos los medios posibles, el cumplimiento de un mandato de autoridad que cumpla con todos los requisitos legales;"
Código Penal AguascalientesArtículo 167. Resistencia de particulares,"III. Coaccionar a la autoridad pública, por medio de violencia física o moral, para obligarla a que ejecute u omita un acto oficial sin los requisitos legales, o que no esté dentro de sus atribuciones;"
Código Penal AguascalientesArtículo 167. Resistencia de particulares,IV. La negativa a otorgar la protesta legal o a declarar por quien deba ser examinado en juicio y sin que le aprovechen las excepciones que establezcan las leyes de la materia; o
Código Penal AguascalientesArtículo 167. Resistencia de particulares,"V. Impedir, mediante actos materiales, la ejecución de una obra o trabajo públicos, mandados hacer con los requisitos legales por la autoridad competente, o con su autorización."
Código Penal AguascalientesArtículo 167. Resistencia de particulares,"Al responsable de Resistencia de Particulares se aplicarán de 1 a 3 años de prisión y de 30 a 70 días multa, y al pago total de la reparación de los daños y perjuicios ocasionados."
Código Penal AguascalientesArtículo 167. Resistencia de particulares,"En el caso de la Fracción V del presente Artículo, si se hiciere uso de la violencia, la punibilidad aumentará hasta en una mitad más de la señalada, respecto de los mínimos y máximos."
Código Penal AguascalientesArtículo 168. Quebrantamiento de sellos,"El Quebrantamiento de Sellos consiste en la reanudación de obras o actividades previamente clausuradas mediante la aplicación de sellos, sin que exista autorización de la autoridad que haya colocado tales sellos."
Código Penal AguascalientesArtículo 168. Quebrantamiento de sellos,"Al responsable de Quebrantamiento de Sellos se le aplicarán de 1 a 3 años de prisión y de 50 a 100 días multa, y al pago total de la reparación de los daños y perjuicios ocasionados."
Código Penal AguascalientesArtículo 169. Ejercicio indebido del servicio público,El Ejercicio Indebido del Servicio Público consiste en:
Código Penal AguascalientesArtículo 169. Ejercicio indebido del servicio público,"I. Ejercer funciones de un empleo, cargo o comisión para el que no hubiese sido nombrado, hubiese sido cesado o no se le haya dado posesión;"
Código Penal AguascalientesArtículo 169. Ejercicio indebido del servicio público,"II. Otorgar cualquier identificación que acredite a un particular como servidor público, cuando realmente no desempeñe el empleo, cargo o comisión a que haga referencia tal identificación;"
Código Penal AguascalientesArtículo 169. Ejercicio indebido del servicio público,"III. Abandonar sin justa causa su empleo, cargo o comisión;"
Código Penal AguascalientesArtículo 169. Ejercicio indebido del servicio público,"IV. Sustraer, destruir, ocultar, utilizar o inutilizar ilícitamente información o documentación que se encuentre bajo su custodia o a la cual tenga acceso, o de la que tenga conocimiento en virtud de su empleo, cargo o comisión;"
Código Penal AguascalientesArtículo 169. Ejercicio indebido del servicio público,"V. Otorgar empleo, cargo o comisión pública o contrato de prestación de servicios profesionales, que sean remunerados, sabiendo que no se prestará el servicio para el que se les nombra, o no se cumplirán los términos del contrato celebrado;"
Código Penal AguascalientesArtículo 169. Ejercicio indebido del servicio público,"VI. Autorizar o contratar a quien se encuentre inhabilitado por resolución firme de autoridad competente para desempeñar un empleo, cargo o comisión en el servicio público, o para participar en adquisiciones, arrendamientos, servicios u obras públicas, siempre que tenga conocimiento de tal situación;"
Código Penal AguascalientesArtículo 169. Ejercicio indebido del servicio público,"VII. Otorgar indebidamente, por sí o por interpósita persona:"
Código Penal AguascalientesArtículo 169. Ejercicio indebido del servicio público,"a) Concesiones de prestación de servicios públicos o de explotación, aprovechamiento y uso de bienes de dominio del Estado o del Municipio;"
Código Penal AguascalientesArtículo 169. Ejercicio indebido del servicio público,"b) Permisos, licencias o autorizaciones de contenido económico;"
Código Penal AguascalientesArtículo 169. Ejercicio indebido del servicio público,"c) Franquicias, exenciones, deducciones o subsidios sobre impuestos, derechos, productos, aprovechamientos o aportaciones y cuotas de seguridad social, sobre ingresos fiscales, y sobre precios y tarifas de los bienes y servicios producidos o prestados en la administración pública estatal o municipal; o"
Código Penal AguascalientesArtículo 169. Ejercicio indebido del servicio público,"d) Contratos de obras públicas, deudas, adquisiciones, arrendamientos, enajenaciones de bienes o servicios, o colocaciones de fondos y valores con recursos económicos públicos;"
Código Penal AguascalientesArtículo 169. Ejercicio indebido del servicio público,VIII. Conocer de negocios para los cuales tengan impedimento legal o abstenerse de conocer de los que les corresponde sin tener impedimento legal para ello;
Código Penal AguascalientesArtículo 169. Ejercicio indebido del servicio público,IX. Desempeñar algún otro empleo oficial o un puesto o cargo particular que la Ley les prohíba;
Código Penal AguascalientesArtículo 169. Ejercicio indebido del servicio público,"X. Litigar por sí o por interpósita persona, cuando la ley les prohíba el ejercicio de su profesión;"
Código Penal AguascalientesArtículo 169. Ejercicio indebido del servicio público,XI. Dirigir o aconsejar a las personas que ante ellos litiguen;
Código Penal AguascalientesArtículo 169. Ejercicio indebido del servicio público,"XII. No cumplir una disposición que legalmente se les comunique por su superior competente, sin causa fundada para ello;"
Código Penal AguascalientesArtículo 169. Ejercicio indebido del servicio público,"XIII. Dictar maliciosamente una resolución de fondo o una sentencia definitiva que sean ilícitas por violar algún precepto terminante de la ley o ser contrarias a las actuaciones seguidas en juicio, u omitir dictar una resolución de trámite, de fondo o una sentencia definitiva lícita, dentro de los términos dispuestos en la ley;"
Código Penal AguascalientesArtículo 169. Ejercicio indebido del servicio público,XIV. Ejecutar actos o incurrir en omisiones que produzcan un daño o concedan a alguien una ventaja indebida;
Código Penal AguascalientesArtículo 169. Ejercicio indebido del servicio público,XV. Retardar o entorpecer maliciosamente las actividades de administración pública que le corresponda realizar;
Código Penal AguascalientesArtículo 169. Ejercicio indebido del servicio público,XVI. Abstenerse injustificadamente de hacer la consignación que corresponda con arreglo a la ley de una persona que se encuentre detenida a su disposición como probable responsable de algún delito;
Código Penal AguascalientesArtículo 169. Ejercicio indebido del servicio público,XVII. Ordenar la aprehensión de un individuo cuando no se comprueben plenamente el cuerpo del delito que se le imputa y su probable responsabilidad;
Código Penal AguascalientesArtículo 169. Ejercicio indebido del servicio público,"XVIII. No otorgar, cuando se solicite, la libertad caucional, si procede legalmente, sin fundar y motivar adecuadamente su negativa;"
Código Penal AguascalientesArtículo 169. Ejercicio indebido del servicio público,"XIX. Obligar a un inculpado a declarar, usando la incomunicación, la intimidación, la tortura o tratos crueles, inhumanos o degradantes; así como utilizar violencia física o moral que inhiba o intimide a cualquier persona para evitar que ésta o un tercero denuncie, formule querella o aporte información relativa a la presunta comisión de una conducta sancionada por este Código o por la Ley de Responsabilidades de los Servidores Públicos del Estado;"
Código Penal AguascalientesArtículo 169. Ejercicio indebido del servicio público,XX. Prolongar la prisión preventiva por más tiempo del que como máximo fije la ley al delito que motive el procedimiento;
Código Penal AguascalientesArtículo 169. Ejercicio indebido del servicio público,XXI. Imponer gabelas o contribuciones en cualquier lugar de detención e internamiento;
Código Penal AguascalientesArtículo 169. Ejercicio indebido del servicio público,"XXII. Demorar injustificadamente el cumplimiento de las providencias judiciales, en las que se ordene poner en libertad a un detenido;"
Código Penal AguascalientesArtículo 169. Ejercicio indebido del servicio público,"XXIII. No dictar auto de vinculación a proceso o de libertad de un detenido, dentro de las setenta y dos horas siguientes a las que haya sido puesto a disposición de la autoridad judicial;"
Código Penal AguascalientesArtículo 169. Ejercicio indebido del servicio público,XXIV. Ordenar o practicar cateos o visitas domiciliarias fuera de los casos autorizados por la ley;
Código Penal AguascalientesArtículo 169. Ejercicio indebido del servicio público,"XXV. Ejercitar acción penal contra un servidor público con fuero, sin habérsele retirado éste previamente, conforme a lo dispuesto por la ley;"
Código Penal AguascalientesArtículo 169. Ejercicio indebido del servicio público,XXVI.
Código Penal AguascalientesArtículo 169. Ejercicio indebido del servicio público,Realizar la aprehensión sin poner inmediatamente al detenido a disposición del juez.
Código Penal AguascalientesArtículo 169. Ejercicio indebido del servicio público,"En el caso de los elementos de las instituciones políticas estatales y municipales, liberar a una persona detenida en flagrancia sin razón que lo justifique."
Código Penal AguascalientesArtículo 169. Ejercicio indebido del servicio público,"XXVII. A los encargados o empleados de lugares de reclusión o internamiento que cobren cualquier cantidad a los internos o a sus familiares a cambio de proporcionarles bienes o servicios que gratuitamente brinde el Estado para otorgarles condiciones de privilegio en el alojamiento, alimentación o régimen;"
Código Penal AguascalientesArtículo 169. Ejercicio indebido del servicio público,"XXVIII. Rematar, en favor de ellos mismos, por sí o por interpósita persona, los bienes objeto de un remate en cuyo oficio hubieran intervenido;"
Código Penal AguascalientesArtículo 169. Ejercicio indebido del servicio público,"XXIX. Admitir o nombrar un depositario o entregar a éste los bienes secuestrados, sin el cumplimiento de los requisitos legales correspondientes;"
Código Penal AguascalientesArtículo 169. Ejercicio indebido del servicio público,XXX.
Código Penal AguascalientesArtículo 169. Ejercicio indebido del servicio público,"Hacer conocer al demandado, indebidamente, la providencia de embargo decretada en"
Código Penal AguascalientesArtículo 169. Ejercicio indebido del servicio público,su contra;
Código Penal AguascalientesArtículo 169. Ejercicio indebido del servicio público,"XXXI. Permitir, fuera de los casos previstos por la Ley, la salida temporal de las personas que están recluidas o favorecer la evasión de algún detenido, procesado o condenado;"
Código Penal AguascalientesArtículo 169. Ejercicio indebido del servicio público,XXXII. Ostentarse como servidor público quien no lo sea a fin de lograr un lucro indebido o una prestación que no le corresponda;
Código Penal AguascalientesArtículo 169. Ejercicio indebido del servicio público,"XXXIII. Utilizar o haber utilizado, la fuerza o los medios a su disposición o bajo su mando resguardo, o brinde facilidades o protección o le proporcione materiales a cualquier persona para la comisión de un delito o a quien se le impute un delito;"
Código Penal AguascalientesArtículo 169. Ejercicio indebido del servicio público,"XXXIV. Comunicar a cualquier persona a quien se le impute un delito, información de la que tenga o haya tenido acceso por su empleo, cargo o comisión y que hubiere podido facilitarle la realización de dicho ilícito;"
Código Penal AguascalientesArtículo 169. Ejercicio indebido del servicio público,"XXXV. Inducir a uno o más elementos activos de las instituciones policiales o servidores públicos de una institución de procuración o de administración de justicia o de ejecución de sanciones, a participar en actividades ilícitas;"
Código Penal AguascalientesArtículo 169. Ejercicio indebido del servicio público,"XXXVI. Poner fuera del procedimiento legal y sin tener facultades para ello, en libertad a un detenido;"
Código Penal AguascalientesArtículo 169. Ejercicio indebido del servicio público,"XXXVII. Abstenerse de informar por escrito a su superior jerárquico cualquier acto u omisión que sea de su conocimiento por razón de su empleo, cargo o comisión cuando pueda resultar gravemente afectados  el patrimonio o los intereses de alguna dependencia o entidad de la Administración Pública Estatal, del Congreso del Estado o del Poder Judicial del Estado;"
Código Penal AguascalientesArtículo 169. Ejercicio indebido del servicio público,"XXXVIII. Aplicar los recursos públicos de manera distinta a aquella a la que estuvieren destinados o realizar un pago ilegal, cuando tenga a su cargo dichos recursos; o"
Código Penal AguascalientesArtículo 169. Ejercicio indebido del servicio público,"XXXIX. Otorgar por sí o por interpósita persona, contratos, concesiones, permisos, licencias, autorizaciones, franquicias, exenciones o efectúe compras o ventas o realice cualquier acto jurídico que produzca beneficios económicos al propio servidor público, a su cónyuge, descendiente o ascendiente, parientes por consanguinidad o afinidad hasta el cuarto grado, a cualquier tercero con el que tenga vínculos afectivos, económicos o de dependencia administrativa directa, socios o sociedades de las que el servidor público o las personas antes referidas formen parte."
Código Penal AguascalientesArtículo 169. Ejercicio indebido del servicio público,"Al responsable de Ejercicio Indebido de Servicio Público, se le impondrá de 3 meses a 12 años de prisión, y de 30 a 100 días multa, cuando el delito no importe alguna cuantía."
Código Penal AguascalientesArtículo 169. Ejercicio indebido del servicio público,"Cuando los delitos importen una cuantía que no exceda del equivalente a 500 veces el valor diario de la Unidad de Medida y Actualización en el momento de cometerse el delito, se impondrán de 3 meses a 2 años de prisión y de 30 a 100 días multa."
Código Penal AguascalientesArtículo 169. Ejercicio indebido del servicio público,"Cuando la cuantía exceda de 500 veces el valor diario de la Unidad de Medida y Actualización en el momento de cometerse el delito, se impondrán de 2 años a 12 años de prisión y de 100 a 150 días multa"
Código Penal AguascalientesArtículo 170. Abuso de autoridad,El Abuso de Autoridad consiste en:
Código Penal AguascalientesArtículo 170. Abuso de autoridad,"I. Impedir la ejecución de una ley, decreto o reglamento, el cobro de un impuesto o el cumplimiento de una resolución judicial, mediante el uso de la fuerza pública;"
Código Penal AguascalientesArtículo 170. Abuso de autoridad,"II. Hacer violencia sobre una persona sin causa legítima, vejarla o insultarla en el ejercicio de sus funciones o con motivo de ellas;"
Código Penal AguascalientesArtículo 170. Abuso de autoridad,III. Retardar indebidamente o negar a los particulares la protección o servicio que tenga obligación de otorgarles o impedir la presentación o el curso de una solicitud;
Código Penal AguascalientesArtículo 170. Abuso de autoridad,"IV. Negarse injustificadamente y bajo cualquier pretexto, el encargado de administrar justicia, a despachar un negocio pendiente dentro de los términos establecidos por la Ley;"
Código Penal AguascalientesArtículo 170. Abuso de autoridad,"V. Negarse indebidamente el encargado de una fuerza pública, requerida legalmente por una autoridad competente, a proporcionar el auxilio solicitado;"
Código Penal AguascalientesArtículo 170. Abuso de autoridad,"VI. Recibir, sin los requisitos constitucionales y legales, el encargado de cualquier establecimiento, destinado a la ejecución de las sanciones privativas de libertad, de instituciones de reinserción social o de custodia y rehabilitación de menores y de reclusorios preventivos o administrativos, a una persona privada de su libertad y mantenerla en ese lugar, sin informar de ello a la autoridad correspondiente; negar que esté privada de su libertad, si lo estuviere, o no cumplir la orden de libertad girada por la autoridad competente;"
Código Penal AguascalientesArtículo 170. Abuso de autoridad,"VII. No denunciar de manera inmediata a la autoridad competente de una privación ilegal de libertad o no la haga cesar, si esto último estuviere dentro de sus atribuciones; o"
Código Penal AguascalientesArtículo 170. Abuso de autoridad,"VIII. Obtener, exigir o solicitar sin derecho o causa legítima, para sí o para cualquier otra persona, de un subalterno, parte de su sueldo o remuneración, dádivas u otros bienes servicios con cualquier pretexto."
Código Penal AguascalientesArtículo 170. Abuso de autoridad,"Al responsable de Abuso de Autoridad se le aplicarán de 1 a 9 años de prisión, y de 50 a 150 días multa"
Código Penal AguascalientesArtículo 171. Coalición de servidores públicos,"La Coalición de Servidores Públicos consiste en la reunión de servidores públicos para tomar medidas contrarias a una ley, reglamento u otras disposiciones, impedir su ejecución o para hacer dimisión de sus puestos con el fin de impedir o suspender la administración pública en cualquiera de sus ramas."
Código Penal AguascalientesArtículo 171. Coalición de servidores públicos,A los responsables de Coalición de Servidores Públicos se les impondrán de 2 años a 7 años de prisión y de 30 a 300 días multa.
Código Penal AguascalientesArtículo 171. Coalición de servidores públicos,No se configura el tipo de Coalición de Servidores Públicos cuando los trabajadores al servicio del Estado se unifiquen en ejercicio de sus derechos constitucionales o que hagan uso legítimo del derecho de huelga.
Código Penal AguascalientesArtículo 172. Concusión,"La Concusión consiste en la exigencia que haga el servidor público, por sí o por medio de otro, y a título de impuesto o contribución, recargo, renta, rédito, salario o emolumento, de dinero, valores, servicios, o cualquiera otra cosa que sepa no ser debida, o en mayor cantidad que la señalada por la ley."
Código Penal AguascalientesArtículo 172. Concusión,"Cuando la cantidad o el valor de lo exigido indebidamente no exceda del equivalente de 500 días de Unidades de Medida y Actualización en el momento de cometerse el delito, o no sea valorable, se impondrán de 3 meses a 2 años de prisión y de 30 a 100 días multa."
Código Penal AguascalientesArtículo 172. Concusión,"Cuando la cantidad o el valor de lo exigido indebidamente exceda de 500 días de Unidades de Medida y Actualización en el momento de cometerse el delito, se impondrán de 2 años a 12 años de prisión y de 100 a 150 días multa"
Código Penal AguascalientesArtículo 173. Cohecho,El Cohecho consiste en:
Código Penal AguascalientesArtículo 173. Cohecho,"I. La solicitud u obtención ilícita de dinero o cualquier otra dádiva, o acepte una promesa, para sí o para otro, el servidor público, por sí o por interpósita persona, para hacer o dejar de realizar un acto propio de sus funciones inherentes a su empleo, cargo o comisión; o"
Código Penal AguascalientesArtículo 173. Cohecho,"II. El ofrecimiento o entrega de dinero o cualquier otra dádiva que de manera espontánea haga el particular a favor de los servidores públicos, para que hagan u omitan un acto relacionado con sus funciones inherentes a su empleo, cargo o comisión."
Código Penal AguascalientesArtículo 173. Cohecho,Al responsable de Cohecho se le impondrán las siguientes sanciones:
Código Penal AguascalientesArtículo 173. Cohecho,"Cuando la cantidad o el valor de la dádiva, los bienes, promesa o prestación no exceda del equivalente de 500 veces el valor diario de la Unidad de Medida y Actualización en el momento de cometerse el delito, o no sea valorable, se impondrán de 3 meses a 2 años de prisión y de 30 a 100 días multa."
Código Penal AguascalientesArtículo 173. Cohecho,"Cuando la cantidad o el valor de la dádiva, los bienes, promesa o prestación exceda de 500 veces el valor diario de la Unidad de Medida y Actualización en el momento de cometerse el delito, se impondrán de 2 a 14 años de prisión y de 100 a 150 días multa."
Código Penal AguascalientesArtículo 173. Cohecho,"En ningún caso se devolverá a los responsables del delito de Cohecho, el dinero o dádivas entregadas, las mismas se aplicarán en beneficio del Estado."
Código Penal AguascalientesArtículo 174. Peculado,El Peculado consiste en:
Código Penal AguascalientesArtículo 174. Peculado,"I. La distracción que haga el servidor público, para su beneficio o el de una tercera persona física o moral, de dinero, valores, fincas o cualquier cosa perteneciente al Estado o a un Municipio, a un organismo descentralizado o a un particular, si por razón de su cargo los hubiese recibido en administración, en depósito, en posesión o por otra causa;"
Código Penal AguascalientesArtículo 174. Peculado,"II. La utilización ilícita por el servidor público de fondos públicos con el objeto de promover la imagen política o social de su persona, la de su superior jerárquico o la de un tercero, o a fin de denigrar a cualquier persona; así como la solicitud o aceptación de cualquier persona para realizar las promociones o denigraciones a que se refiere esta fracción, a cambio de fondos públicos o del disfrute de los beneficios derivados de los actos a que se refiere el artículo del Ejercicio Indebido del Servicio Público;"
Código Penal AguascalientesArtículo 174. Peculado,"III. La distracción que de su objeto haga cualquier persona que, sin tener el carácter de servidor público estatal o municipal, está obligada legalmente a la custodia, administración o aplicación de recursos públicos estatales o municipales, para usos propios o ajenos, o les dé una aplicación distinta a la que se les haya destinado."
Código Penal AguascalientesArtículo 174. Peculado,Al responsable de Peculado se le aplicarán las siguientes sanciones:
Código Penal AguascalientesArtículo 174. Peculado,"Cuando el monto de lo distraído o de los fondos utilizados indebidamente no exceda del equivalente de 500 veces el valor diario de la Unidad de Medida y Actualización en el momento de cometerse el delito, o no sea valorable, se impondrán de 3 meses a 2 años de prisión y de 30 a 100 días multa."
Código Penal AguascalientesArtículo 174. Peculado,"Cuando el monto de lo distraído o de los fondos utilizados indebidamente exceda de 500 veces el valor diario de la Unidad de Medida y Actualización en el momento de cometerse el delito, se impondrán de 2 años a 14 años de prisión y de 100 a 150 días multa."
