h1,p
Código Penal AguascalientesArtículo 117. Pornografía infantil o de incapaces,"Al responsable de Pornografía infantil y de incapaces se le aplicarán de 7 a 14 años de prisión y de 300 a 700 días multa, y al pago total de la reparación de los daños y perjuicios ocasionados; cuando la víctima sea menor de 12 años de edad o persona que no tenga capacidad para comprender el significado del hecho o resistirlo, se le aplicarán de 8 a 15 años de prisión, de 350 a 750 días multa, y al pago total de la reparación de los daños y perjuicios ocasionados."
Código Penal AguascalientesArtículo 117. Pornografía infantil o de incapaces,"Si el inculpado es ascendiente, padrastro, o madrastra de la víctima, o habita el mismo domicilio de la víctima, las penas referidas en el párrafo anterior se incrementarán, aplicándose de 14 a 28 años de prisión, de 600 a 1400 días multa, el pago total de la reparación de los daños y perjuicios ocasionados y privación de los derechos de familia que el inculpado tenga en relación con la víctima."
Código Penal AguascalientesArtículo 117. Pornografía infantil o de incapaces,"Si el inculpado labora en organizaciones dedicadas al cuidado o atención de menores de 18 años de edad, o de personas que no tienen capacidad para comprender el significado del hecho o resistirlo, también se le aplicará como pena la privación del cargo, empleo o comisión que ahí desempeñe."
Código Penal AguascalientesArtículo 118. Estupro,"El estupro consiste en realizar cópula con persona mayor de doce y menor de dieciséis años de edad, obteniendo su consentimiento por medio de seducción o engaño."
Código Penal AguascalientesArtículo 118. Estupro,"Al responsable de Estupro se le aplicarán de 1 a 6 años de prisión y de 25 a 75 días multa, y al pago total de la reparación de los daños y perjuicios ocasionados."
Código Penal AguascalientesArtículo 118. Estupro,"La reparación del daño, comprenderá además el pago de los alimentos a la víctima y también a los hijos si los hubiera."
Código Penal AguascalientesArtículo 118. Estupro,El pago de los alimentos se hará en la forma y términos que la ley civil fije para el efecto
Código Penal AguascalientesArtículo 119. Violación,"La Violación consiste en realizar cópula con persona de cualquier sexo, utilizando fuerza física, moral o psicológica, para lograr el sometimiento de la víctima."
Código Penal AguascalientesArtículo 119. Violación,"Al responsable de Violación se le aplicarán de 10 a 16 años de prisión y de 100 a 200 días multa y al pago total de la reparación de los daños y perjuicios ocasionados. Si la víctima es mayor de 12 años pero menor de 18 años de edad, al responsable se le aplicarán de 12 a 18 años de prisión y de 150 a 250 días multa, y al pago total de la reparación de los daños y perjuicios ocasionados."
Código Penal AguascalientesArtículo 119. Violación,"Si entre el activo y pasivo de la Violación, existiera un vínculo matrimonial o de concubinato, se impondrá la pena prevista en el presente Artículo; y en su caso, el aumento de sanción prevista en el Artículo 124 de este Código."
Código Penal AguascalientesArtículo 119. Violación,"Para los efectos de este Código, se entiende por cópula la introducción del pene en el cuerpo humano, por vía vaginal, anal u oral."
Código Penal AguascalientesArtículo 120. Violación equiparada,"También se equiparan a la Violación, los hechos punibles siguientes:"
Código Penal AguascalientesArtículo 120. Violación equiparada,I.- Realizar cópula con persona menor de doce años de edad sin hacer uso de la fuerza física o moral;
Código Penal AguascalientesArtículo 120. Violación equiparada,"II.- Realizar cópula con persona que no tenga capacidad para comprender el significado del hecho, o que por cualquier causa no pueda resistirla, sin uso de la fuerza física o moral de parte del inculpado;"
Código Penal AguascalientesArtículo 120. Violación equiparada,"III.- Introducir por vía vaginal o anal cualquier elemento o instrumento distinto del pene, mediante el uso de la fuerza física, moral o psicológica para el sometimiento de la víctima, sea cual fuere el sexo de ésta;"
Código Penal AguascalientesArtículo 120. Violación equiparada,IV.- El llevar a cabo la introducción descrita en la Fracción III en persona menor de doce años de edad sin hacer uso de la fuerza física o moral; o
Código Penal AguascalientesArtículo 120. Violación equiparada,"V.- El llevar a cabo la introducción descrita en la Fracción III en persona que no tenga capacidad para comprender el significado del hecho, o que por cualquier causa no pueda resistirla, sin uso de la fuerza física o moral de parte del inculpado."
Código Penal AguascalientesArtículo 120. Violación equiparada,"Al responsable de Violación Equiparada descrita en las Fracciones I y II se le aplicarán de 12 a 18 años de prisión y de 150 a 250 días multa, y al pago total de la reparación de los daños y perjuicios ocasionados; si además el responsable hace uso de la fuerza física o moral sobre la clase de víctimas señaladas en el presente Artículo, la punibilidad será de 15 a 25 años de prisión y de 250 a 300 días multa, y al pago total de la reparación de los daños y perjuicios ocasionados."
Código Penal AguascalientesArtículo 120. Violación equiparada,"Al responsable de Violación Equiparada descrita en la Fracción III se le aplicarán de 5 a 10 años de prisión y de 100 a 200 días multa, y al pago total de la reparación de los daños y perjuicios ocasionados."
Código Penal AguascalientesArtículo 120. Violación equiparada,"Al responsable de Violación Equiparada descrita en las Fracciones IV y V se le aplicarán de 6 a 12 años de prisión y de 120 a 240 días multa, y al pago total de la reparación de los daños y perjuicios ocasionados; si además el responsable utiliza la fuerza física o moral respecto de la clase de víctimas señaladas en el presente Artículo, la punibilidad será de 8 a 15 años de prisión y de 150 a 250 días multa, y al pago total de la reparación de los daños y perjuicios ocasionados."
Código Penal AguascalientesArtículo 121. Alimentos en caso de violación,"Si como consecuencia de violación resultan hijos, la reparación del daño, en este caso, comprenderá además el pago de los alimentos a la mujer y también a los hijos, si los hubiera."
Código Penal AguascalientesArtículo 121. Alimentos en caso de violación,El pago de los alimentos se hará en la forma y términos que la ley civil fije para el efecto.
Código Penal AguascalientesArtículo 122. ,Se deroga
Código Penal AguascalientesArtículo 123. ,Se deroga
Código Penal AguascalientesArtículo 124. Aumento de sanción,"La punibilidad prevista para los Tipos Penales de violación, violación equiparada, estupro y atentados al pudor, se aumentará de conformidad con lo siguiente:"
Código Penal AguascalientesArtículo 124. Aumento de sanción,"I.- En una mitad en sus mínimos y sus máximos, tratándose de violación, violación equiparada, estupro o atentados al pudor, si concurre alguna de las siguientes circunstancias:"
Código Penal AguascalientesArtículo 124. Aumento de sanción,a) Los hechos descritos sean cometidos a nivel de coautoría;
Código Penal AguascalientesArtículo 124. Aumento de sanción,b) Los hechos descritos sean cometidos por servidores públicos con motivo del ejercicio de sus funciones; o
Código Penal AguascalientesArtículo 124. Aumento de sanción,"c) Los hechos descritos sean cometidos por ascendiente contra su descendiente, el hermano con su colateral, el tutor con su pupilo o el padrastro o amasio de la madre con el hijastro, el maestro con el alumno o el guía religioso con su asesorado;"
Código Penal AguascalientesArtículo 124. Aumento de sanción,d) Derogado
Código Penal AguascalientesArtículo 124. Aumento de sanción,e)Derogado
Código Penal AguascalientesArtículo 124. Aumento de sanción,"f) II.- En una mitad en sus mínimos y sus máximos, tratándose de violación equiparada o atentados al pudor, si para llevar la conducta típica y obtener su resultado, se suministraron a la víctima sustancias estupefacientes, psicotrópicas o cualquiera de otra que produzca efectos similares; o"
Código Penal AguascalientesArtículo 124. Aumento de sanción,g) Derogado
Código Penal AguascalientesArtículo 124. Aumento de sanción,h) Derogado
Código Penal AguascalientesArtículo 124. Aumento de sanción,"i) III.- En una cuarta en sus mínimos y sus máximos, tratándose de violación , violación equiparada o atentados al pudor, cuando el responsable tenga o haya tenido relación de pareja con la victima."
Código Penal AguascalientesArtículo 124. Aumento de sanción,j) Derogado
Código Penal AguascalientesArtículo 124. Aumento de sanción,k) Derogado
Código Penal AguascalientesArtículo 125. Fecundación artificial indebida,"La Fecundación Artificial Indebida, consiste en utilizar cualquier medio diferente al coito sobre una mujer con el fin de preñarla, sin su consentimiento o con su consentimiento tratándose de una menor de dieciocho años de edad o incapaz de comprender el significado del hecho o para resistirlo."
Código Penal AguascalientesArtículo 125. Fecundación artificial indebida,l)
Código Penal AguascalientesArtículo 125. Fecundación artificial indebida,"m) Al responsable de Fecundación Artificial Indebida, se le aplicarán de 5 a 10 años de prisión y de 20 a 100 días multa, y el pago total de la reparación de los daños y perjuicios ocasionados. Cuando la víctima resulte preñada, la punibilidad será de 7 a 14 años de prisión y de 50 a 150 días multa, y el pago total de la reparación de los daños y perjuicios ocasionados."
Código Penal AguascalientesArtículo 125. Fecundación artificial indebida,"Además de las penas señaladas en el párrafo anterior, se impondrá al responsable la suspensión del empleo o profesión por un tiempo igual al de la pena de prisión Impuesta, siempre que en virtud de su ejercicio haya realizado la Fecundación Artificial Indebida; o bien, en caso de que el responsable sea servidor público se le privará del empleo, cargo o comisión público que haya estado desempeñando, siempre que en virtud de su ejercicio haya cometido dicha conducta típica"
Código Penal AguascalientesArtículo 126. Tráfico de menores,"El Tráfico de Menores consiste en la entrega ilegítima de un menor a un tercero para su custodia definitiva, a cambio de un beneficio económico, por quien ejerza la patria potestad o la tenga a su cargo."
Código Penal AguascalientesArtículo 126. Tráfico de menores,Al responsable de Tráfico de Menores se le aplicarán de 5 a 10 años de prisión y de 200 a
Código Penal AguascalientesArtículo 126. Tráfico de menores,"300 días multa, y al pago total de la reparación de los daños y perjuicios ocasionados, considerándose como tal, no sólo quien entrega al menor, sino también el tercero que lo recibe."
Código Penal AguascalientesArtículo 126. Tráfico de menores,"Si la entrega del menor se hace sin la finalidad de obtener un beneficio económico, la punibilidad será de 2 a 4 años de prisión y de 20 a 125 días multa, y al pago total de la reparación de los daños y perjuicios ocasionados."
Código Penal AguascalientesArtículo 126. Tráfico de menores,"Si quien recibe al menor acredita que lo hizo para incorporarlo a un núcleo familiar para otorgarle los beneficios propios de tal incorporación, la punibilidad será de 6 meses a 2 años de prisión y de 5 a 40 días multa, y al pago total de la reparación de los daños y perjuicios ocasionados."
Código Penal AguascalientesArtículo 127. Sustracción de menores e incapaces,"La Sustracción de Menores e Incapaces consiste en sustraer o retener a un menor de doce años o a un incapaz, sin el consentimiento de quien legítimamente tenga su custodia, guarda o retención."
Código Penal AguascalientesArtículo 127. Sustracción de menores e incapaces,"Al responsable de Sustracción de Menores e Incapaces se le aplicarán de 4 a 10 años de prisión y de 10 a 60 días multa, y al pago total de la reparación de los daños y perjuicios ocasionados. Si el responsable es familiar del menor o incapaz y no ejerce sobre él la custodia, la tutela o la guarda, se le aplicarán de 2 a 4 años de prisión y de 5 a 40 días multa, y al pago total de la reparación de los daños y perjuicios ocasionados"
Código Penal AguascalientesArtículo 128. Incesto,"El Incesto es la realización voluntaria de cópula entre parientes consanguíneos, sean ascendientes, descendientes o hermanos, con conocimiento de su parentesco."
Código Penal AguascalientesArtículo 128. Incesto,"A los responsables de Incesto se les aplicarán de 6 meses a 5 años de prisión y de 10 a 100 días multa, y al pago total de la reparación de los daños y perjuicios ocasionados"
Código Penal AguascalientesArtículo 129. Bigamia,"La Bigamia consiste en contraer nuevo matrimonio sin hallarse legítimamente disuelto o declarado nulo el anterior, con conocimiento de esa circunstancia por el o los inculpados."
Código Penal AguascalientesArtículo 129. Bigamia,"A los responsables de Bigamia se les aplicarán de 1 a 5 años de prisión y de 30 a 80 días multa, y al pago total de la reparación de los daños y perjuicios ocasionados"
Código Penal AguascalientesArtículo 130. Alteración del estado civil,La Alteración de Estado Civil consiste en:
Código Penal AguascalientesArtículo 130. Alteración del estado civil,I. Atribuir un recién nacido a una mujer que no sea realmente su madre;
Código Penal AguascalientesArtículo 130. Alteración del estado civil,"II. Registrar en las oficialías de la Dirección del Registro Civil en el Estado, un nacimiento o fallecimiento no verificado;"
Código Penal AguascalientesArtículo 130. Alteración del estado civil,"III. No registrar los padres a un hijo suyo en las oficialías de la Dirección del Registro Civil en el Estado, con el propósito de hacerle perder su estado civil; declarar falsamente su fallecimiento; o presentarlo ocultando sus nombres y apellidos reales o suponiendo que los padres son otras personas;"
Código Penal AguascalientesArtículo 130. Alteración del estado civil,IV. Sustituir un niño por otro u ocultar a un infante; o
Código Penal AguascalientesArtículo 130. Alteración del estado civil,"V. Usurpar el estado civil de otro, con el fin de adquirir derechos de familia que no le correspondan."
Código Penal AguascalientesArtículo 130. Alteración del estado civil,"Al responsable de Alteración de Estado Civil se le aplicarán de 1 a 5 años de prisión y de 30 a 80 días multa, y al pago total de la reparación de los daños y perjuicios ocasionados"
Código Penal AguascalientesArtículo 131. Incumplimiento de las obligaciones de asistencia familiar,El Incumplimiento de las Obligaciones de Asistencia Familiar consiste en:
Código Penal AguascalientesArtículo 131. Incumplimiento de las obligaciones de asistencia familiar,"I. No cumplir con la obligación de dar alimentos en términos de lo establecido en el Código Civil del Estado de Aguascalientes, independientemente de que sean brindados por quien tenga bajo su cuidado a los acreedores alimentarios o sean proporcionados por cualquier otra persona;"
Código Penal AguascalientesArtículo 131. Incumplimiento de las obligaciones de asistencia familiar,"II. Colocarse dolosamente en estado de insolvencia con el objeto de eludir el cumplimiento de las obligaciones alimentarias que el Código Civil del Estado de Aguascalientes determina, independientemente de que los alimentos sean proporcionados por quien tenga bajo su cuidado a los acreedores alimentarios o sean proporcionados por cualquier otra persona; o"
Código Penal AguascalientesArtículo 131. Incumplimiento de las obligaciones de asistencia familiar,"III. La alteración o variación de nombre, domicilio o ingresos con el fin de eludir una responsabilidad de orden familiar o el incumplimiento de obligaciones alimentarias que el Código Civil del Estado de Aguascalientes determina, independientemente de que los alimentos sean proporcionados por quien tenga bajo su cuidado a los acreedores alimentarios o sean proporcionados por cualquier otra persona;"
Código Penal AguascalientesArtículo 131. Incumplimiento de las obligaciones de asistencia familiar,"Al responsable de Incumplimiento de las Obligaciones de Asistencia Familiar se le aplicarán de 6 meses a 3 años de prisión, al pago total de la reparación de los daños y perjuicios ocasionados, y suspensión o privación de los derechos de familia, en relación con la víctima."
Código Penal AguascalientesArtículo 132. Violencia familiar,La violencia familiar consiste en usar la fuerza física o moral en contra de un miembro de la familia por otro integrante de la misma y que ello le cause afectación en su integridad física o psíquica.
Código Penal AguascalientesArtículo 132. Violencia familiar,"Se consideran autores de violencia familiar a los cónyuges, la concubina o el concubino, el pariente consanguíneo en línea recta ascendiente o descendiente sin limitación de grado, el pariente colateral consanguíneo o afín hasta el cuarto grado, el adoptante o el adoptado y el pariente por afinidad hasta el cuarto grado."
Código Penal AguascalientesArtículo 132. Violencia familiar,"Al responsable de violencia familiar se le aplicarán de 1 a 4 años de prisión de 50 a 100 días de multa, así como al pago de la reparación de los daños y perjuicios ocasionados, a la privación de los derechos de familia respectivos, así como a la prohibición de acudir al domicilio de la víctima o acercarse a ésta."
Código Penal AguascalientesArtículo 132. Violencia familiar,"Cuando la violencia se ejerza sobre personas menores de edad, personas de sesenta años o más, personas con discapacidad, embarazadas o cualquier otra circunstancia que no esté en condiciones de resistir la conducta violenta, o cuando la acción básica se realice en el domicilio de la víctima, la pena de prisión se aumentará hasta un cincuenta por ciento más en sus mínimos y máximos."
Código Penal AguascalientesArtículo 133. Violencia a partir de una relación de pareja,"La violencia a partir de una relación de pareja consiste en la violencia psicológica que ejerza una persona en contra de otra en una relación de pareja y que ello le cause afectación en su autoestima o seguridad, con el objeto de controlar, intimidar, humillar, someter o dominar a la persona, impidiendo su libre desarrollo de la personalidad."
Código Penal AguascalientesArtículo 133. Violencia a partir de una relación de pareja,"Al responsable de violencia a partir de una relación de pareja se le aplicarán de 1 a 4 años de prisión y de 50 a 100 días multa, y al pago total de la reparación de los daños y perjuicios ocasionados. La pena de prisión aumentará hasta las dos terceras partes respecto de los mínimos y máximos, cuando la víctima sea menor de 18 años de edad."
Código Penal AguascalientesArtículo 133. Violencia a partir de una relación de pareja,"Exposición de menores o incapaces. La exposición de menores o incapaces consiste en dejar en total exposición, a una persona menor de edad, o que siendo mayor de edad le es imposible cuidar de sí mismo, colocándole en una situación de desamparo, de tal manera que se pongan en riesgo la integridad personal y libre desarrollo de la personalidad; por parte de quienes tienen su guarda y custodia, los hayan acogido materialmente, o tengan el deber de cuidarlo."
Código Penal AguascalientesArtículo 133. Violencia a partir de una relación de pareja,"Al responsable de Exposición de menores o incapaces se le aplicaran de 1 a 4 años de prisión y de 50 100 días multa, además de perder la patria potestad o ser destituido de la tutela, según corresponda"
Código Penal AguascalientesArtículo 134. Privación ilegal de la libertad,"La Privación Ilegal de la Libertad consiste en el arresto o detención de una persona por un particular, fuera de los casos previstos en el Artículo 16 de la Constitución Política de los Estados Unidos Mexicanos, o cuando el particular obligue a una persona, por cualquier medio, a prestarle trabajos y servicios personales sin la debida retribución, o celebre un contrato que ponga en condiciones de servidumbre a otra, o le afecte su libertad de cualquier modo."
Código Penal AguascalientesArtículo 134. Privación ilegal de la libertad,"Al responsable de Privación Ilegal de la Libertad se le aplicarán de 6 meses a 3 años de prisión y de 50 a 150 días multa, y al pago total de la reparación de los daños y perjuicios ocasionados."
Código Penal AguascalientesArtículo 135. Aumento de sanción,"La punibilidad será de 2 a 8 años de prisión y de 100 a 200 días multa, y pago total de la reparación de los daños y perjuicios ocasionados, cuando el hecho descrito en el Artículo 134 se realice:"
Código Penal AguascalientesArtículo 135. Aumento de sanción,"I. Con utilización de fuerza física o moral, o vejación de la víctima;"
Código Penal AguascalientesArtículo 135. Aumento de sanción,"II. En víctima menor de 16 años de edad o mayor de 70, o que por cualquier otra circunstancia esté en situación de desventaja o inferioridad física respecto del inculpado; o"
Código Penal AguascalientesArtículo 135. Aumento de sanción,III. Que el resultado lesivo se prolongue por más de 8 días
Código Penal AguascalientesArtículo 136. Desaparición forzada de personas,La Desaparición Forzada de Personas consiste en:
Código Penal AguascalientesArtículo 136. Desaparición forzada de personas,I. Detener y mantener oculta a una o varias personas; o
Código Penal AguascalientesArtículo 136. Desaparición forzada de personas,"II. Autorizar, apoyar o consentir que otros lo hagan sin reconocer la existencia de tal privación o negar información sobre su paradero."
Código Penal AguascalientesArtículo 136. Desaparición forzada de personas,Tales acciones solo podrán imputarse a los servidores públicos del Estado de Aguascalientes que las lleven a cabo con motivo de sus atribuciones.
Código Penal AguascalientesArtículo 136. Desaparición forzada de personas,"Al responsable de la Desaparición Forzada de Personas se le aplicarán de 10 a 30 años de prisión, de 300 a 600 días multa, al pago total de la reparación de los daños y perjuicios ocasionados, y con inhabilitación para el desempeño de cualquier cargo, empleo o comisión públicos."
Código Penal AguascalientesArtículo 137. Allanamiento de morada,"El Allanamiento de Morada consiste en la introducción furtiva o violenta, con engaño o sin permiso de la persona autorizada para darlo, a una casa-habitación o sus dependencias, o en establecimientos públicos mientras permanezcan cerrados, estando habitados o deshabitados, a cualquier hora del día, por una o varias personas, sin orden de autoridad competente y fuera de los casos que la Ley lo permita."
Código Penal AguascalientesArtículo 137. Allanamiento de morada,"Al responsable de Allanamiento de Morada se le aplicarán de 2 a 7 años de prisión y de 50 a 150 días multa, y al pago total de la reparación de los daños y perjuicios ocasionados"
Código Penal AguascalientesArtículo 138. Omisión de auxilio,La Omisión de Auxilio consiste en:
Código Penal AguascalientesArtículo 138. Omisión de auxilio,"I.No avisar de inmediato a las autoridades estatales, o no prestar el auxilio necesario, a un menor abandonado e incapaz de cuidarse a sí mismo; a una persona herida o inválida, o amenazada de un peligro cualquiera; o"
Código Penal AguascalientesArtículo 138. Omisión de auxilio,"I. Dejar el automovilista, motorista, conductor de un vehículo cualquiera, ciclista o jinete, en estado de abandono, sin prestarle o facilitarle asistencia, a la persona o personas a quienes haya lesionado."
Código Penal AguascalientesArtículo 138. Omisión de auxilio,"Al responsable de Omisión de Auxilio se le aplicarán de 3 meses a 2 años de prisión y de 25 a 50 días multa, y al pago total de la reparación de los daños y perjuicios ocasionados"
Código Penal AguascalientesArtículo 139. Amenazas,"Las Amenazas consisten en la advertencia que se hace a otro con causarle un mal en su persona, bienes, honor o derechos, o en la persona o derechos de alguien con quien esté ligado por algún vínculo, se le impondrá de 6 meses a 2 años de prisión y de 90 a 180 días de multa y a la reparación total de los daños y perjuicios ocasionados."
Código Penal AguascalientesArtículo 139. Amenazas,Se debe entender como ligados por algún vínculo con la persona:
Código Penal AguascalientesArtículo 139. Amenazas,I. A los ascendientes y descendientes consanguíneos o afines;
Código Penal AguascalientesArtículo 139. Amenazas,"II. El cónyuge, la concubina, el concubinario, pareja permanente, parientes colaterales por consanguinidad hasta el cuarto grado y por afinidad hasta el segundo; y"
Código Penal AguascalientesArtículo 139. Amenazas,"III. Los que estén ligados con las personas por amor, respeto, gratitud o estrecha amistad"
Código Penal AguascalientesArtículo 140. Robo,El Robo consiste en:
Código Penal AguascalientesArtículo 140. Robo,"I. El apoderamiento de una cosa ajena mueble, dinero o valores, sin derecho y sin consentimiento de la persona que puede disponer de ella con arreglo a la ley;"
